{
  "$schema": "../../.schema/v1/entity.json",
  "kind": "entity",
  "id": "01JENT00000000000000000001",
  "name": "Order",
  "package": "01JPKG00000000000000000099",
  "stereotypes": [
    "versioned",
    "missing-one"
  ],
  "tags": [
    "billing",
    "urgent"
  ],
  "category": "01JCAT00000000000000000099",
  "key": {
    "attributes": [
      "01JATT00000000000000000101"
    ],
    "strategy": "uuid-v7"
  },
  "attributes": [
    {
      "id": "01JATT00000000000000000101",
      "name": "id",
      "type": "uuid",
      "required": true
    },
    {
      "id": "01JATT00000000000000000102",
      "name": "amount",
      "type": {
        "ref": "01JVBJ00000000000000000099"
      }
    },
    {
      "id": "01JATT00000000000000000103",
      "name": "code",
      "type": "string",
      "length": 10,
      "validation": {
        "rules": [
          "no-such-rule"
        ]
      }
    },
    {
      "id": "01JATT00000000000000000104",
      "name": "owner",
      "type": {
        "ref": "01JPKG00000000000000000001"
      }
    }
  ]
}
