{
  "$schema": "../../.schema/v1/entity.json",
  "kind": "entity",
  "id": "01JENT00000000000000000004",
  "name": "Part",
  "key": {
    "attributes": [
      "01JATT00000000000000000401"
    ],
    "strategy": "uuid-v7"
  },
  "attributes": [
    {
      "id": "01JATT00000000000000000401",
      "name": "id",
      "type": "uuid",
      "required": true
    }
  ]
}
